{
  "schema_version": "ocservia.g6-evidence.v2",
  "candidate_sha": "1111111111111111111111111111111111111111",
  "release_manifest_digest": "sha256:266ded2ea8cb2896fbace4b2b6ef7dcc083042d51047d1bc5cedcc00885c5dac",
  "slo_contract_digest": "sha256:9c27b85be51f00c64be6ed4a4b9074d420d7f6c802f888bf455c78c578fde600",
  "topology_digest": "sha256:88793e954838cbc668cbcb224714712acaae7823b0170d3d8f493f5e25980fcb",
  "started_at": "2026-08-14T00:00:00Z",
  "finished_at": "2026-08-14T00:05:30Z",
  "environment": {
    "environment_id": "g6-12345678",
    "failure_domain_class": "multi_host",
    "authority": "production_readiness"
  },
  "measurements": {
    "stability_sample_span_seconds": {
      "actual": 300,
      "sample_count": 61,
      "source_artifact_digest": "sha256:659ff70ed1fdfeccb9e64dba7b8287cb52f9936bf52731c7951355d157e18ecf"
    },
    "stability_max_sample_gap_seconds": {
      "actual": 5,
      "sample_count": 61,
      "source_artifact_digest": "sha256:659ff70ed1fdfeccb9e64dba7b8287cb52f9936bf52731c7951355d157e18ecf"
    },
    "stability_valid_sample_count": {
      "actual": 61,
      "sample_count": 61,
      "source_artifact_digest": "sha256:659ff70ed1fdfeccb9e64dba7b8287cb52f9936bf52731c7951355d157e18ecf"
    },
    "authorized_real_agents": {
      "actual": 50,
      "sample_count": 50,
      "source_artifact_digest": "sha256:e1abd21a9fbf5db21d8c0a0f2643944c5650ab7c4ff7b1248ebb84be166bff40"
    },
    "max_production_command_inflight": {
      "actual": 50,
      "sample_count": 600,
      "source_artifact_digest": "sha256:dde131d676d61d270c3c08e9f1d91f712b72f0787818f5e028ff69451b58d66e"
    },
    "synthetic_command_completion_seconds_p99": {
      "actual": 4.001,
      "sample_count": 600,
      "source_artifact_digest": "sha256:dde131d676d61d270c3c08e9f1d91f712b72f0787818f5e028ff69451b58d66e"
    },
    "stale_owner_accepts": {
      "actual": 0,
      "sample_count": 3,
      "source_artifact_digest": "sha256:4a6c65dfdd436e102fef6b9ef8ebbdc1d7b7bb248fcff7a12a00c1751a5f354a"
    },
    "concurrent_active_connection_owners": {
      "actual": 1,
      "sample_count": 150,
      "source_artifact_digest": "sha256:4a6c65dfdd436e102fef6b9ef8ebbdc1d7b7bb248fcff7a12a00c1751a5f354a"
    },
    "stale_scheduler_commits": {
      "actual": 0,
      "sample_count": 3,
      "source_artifact_digest": "sha256:4a6c65dfdd436e102fef6b9ef8ebbdc1d7b7bb248fcff7a12a00c1751a5f354a"
    },
    "concurrent_active_scheduler_leaders": {
      "actual": 1,
      "sample_count": 2,
      "source_artifact_digest": "sha256:4a6c65dfdd436e102fef6b9ef8ebbdc1d7b7bb248fcff7a12a00c1751a5f354a"
    },
    "dual_primary_write_accepts": {
      "actual": 0,
      "sample_count": 2,
      "source_artifact_digest": "sha256:b81e6928a5fe3cf5748b790b621e8eacc9cde6401aee1889345d3c1ccbbbab1e"
    },
    "duplicate_remote_effects": {
      "actual": 0,
      "sample_count": 602,
      "source_artifact_digest": "sha256:dde131d676d61d270c3c08e9f1d91f712b72f0787818f5e028ff69451b58d66e"
    },
    "acknowledged_transaction_loss": {
      "actual": 0,
      "sample_count": 3,
      "source_artifact_digest": "sha256:b81e6928a5fe3cf5748b790b621e8eacc9cde6401aee1889345d3c1ccbbbab1e"
    },
    "unreconciled_outbox_rows": {
      "actual": 0,
      "sample_count": 600,
      "source_artifact_digest": "sha256:11371f57dad0104f9fdd74cb0d387acd8eff1826efc0914fdcc4cdc7f280773c"
    },
    "unreconciled_unknown_commands": {
      "actual": 0,
      "sample_count": 600,
      "source_artifact_digest": "sha256:11371f57dad0104f9fdd74cb0d387acd8eff1826efc0914fdcc4cdc7f280773c"
    },
    "quarantined_unmatched_command_results": {
      "actual": 0,
      "sample_count": 602,
      "source_artifact_digest": "sha256:dde131d676d61d270c3c08e9f1d91f712b72f0787818f5e028ff69451b58d66e"
    },
    "database_rpo_seconds": {
      "actual": 5,
      "sample_count": 3,
      "source_artifact_digest": "sha256:b81e6928a5fe3cf5748b790b621e8eacc9cde6401aee1889345d3c1ccbbbab1e"
    },
    "database_rto_seconds": {
      "actual": 62,
      "sample_count": 1,
      "source_artifact_digest": "sha256:b81e6928a5fe3cf5748b790b621e8eacc9cde6401aee1889345d3c1ccbbbab1e"
    },
    "connection_owner_takeover_seconds": {
      "actual": 0.249,
      "sample_count": 50,
      "source_artifact_digest": "sha256:4a6c65dfdd436e102fef6b9ef8ebbdc1d7b7bb248fcff7a12a00c1751a5f354a"
    },
    "scheduler_takeover_seconds": {
      "actual": 10.000001,
      "sample_count": 1,
      "source_artifact_digest": "sha256:4a6c65dfdd436e102fef6b9ef8ebbdc1d7b7bb248fcff7a12a00c1751a5f354a"
    },
    "relay_takeover_seconds": {
      "actual": 5,
      "sample_count": 1,
      "source_artifact_digest": "sha256:e77e5196f55357e1b0a3e1c42498eab2148ee59401bb06f459cf816340319466"
    },
    "reconnect_storm_recovery_seconds": {
      "actual": 69.1,
      "sample_count": 50,
      "source_artifact_digest": "sha256:e1abd21a9fbf5db21d8c0a0f2643944c5650ab7c4ff7b1248ebb84be166bff40"
    },
    "read_api_success_ratio": {
      "actual": 1,
      "sample_count": 600,
      "source_artifact_digest": "sha256:37cd813fac99f98c506849504419965ac9bfb83d467d59322d4c10ae1e58d9f7"
    },
    "enqueue_success_ratio": {
      "actual": 1,
      "sample_count": 600,
      "source_artifact_digest": "sha256:37cd813fac99f98c506849504419965ac9bfb83d467d59322d4c10ae1e58d9f7"
    },
    "enqueue_latency_seconds_p95": {
      "actual": 0.14,
      "sample_count": 600,
      "source_artifact_digest": "sha256:37cd813fac99f98c506849504419965ac9bfb83d467d59322d4c10ae1e58d9f7"
    },
    "telemetry_fresh_ratio": {
      "actual": 1,
      "sample_count": 50,
      "source_artifact_digest": "sha256:b4c4d6a655902e0a5eaa4b4f55f05ec2b76afdb5cb4ab39c6e922d0f154dad3f"
    },
    "telemetry_fresh_age_seconds": {
      "actual": 60,
      "sample_count": 50,
      "source_artifact_digest": "sha256:b4c4d6a655902e0a5eaa4b4f55f05ec2b76afdb5cb4ab39c6e922d0f154dad3f"
    },
    "command_dispatch_ratio": {
      "actual": 1,
      "sample_count": 600,
      "source_artifact_digest": "sha256:dde131d676d61d270c3c08e9f1d91f712b72f0787818f5e028ff69451b58d66e"
    },
    "command_dispatch_seconds": {
      "actual": 10,
      "sample_count": 600,
      "source_artifact_digest": "sha256:dde131d676d61d270c3c08e9f1d91f712b72f0787818f5e028ff69451b58d66e"
    },
    "audit_completeness_ratio": {
      "actual": 1,
      "sample_count": 600,
      "source_artifact_digest": "sha256:d39d997366824da9fe6c620b912f44f0c481569ab3d5de6987364b5aceab680d"
    },
    "terminal_or_reconciled_operation_ratio": {
      "actual": 1,
      "sample_count": 600,
      "source_artifact_digest": "sha256:11371f57dad0104f9fdd74cb0d387acd8eff1826efc0914fdcc4cdc7f280773c"
    },
    "controller_rss_growth_ratio": {
      "actual": 0.0005859375,
      "sample_count": 183,
      "source_artifact_digest": "sha256:659ff70ed1fdfeccb9e64dba7b8287cb52f9936bf52731c7951355d157e18ecf"
    },
    "transportd_rss_growth_ratio": {
      "actual": 0.001171875,
      "sample_count": 61,
      "source_artifact_digest": "sha256:659ff70ed1fdfeccb9e64dba7b8287cb52f9936bf52731c7951355d157e18ecf"
    },
    "agent_rss_growth_ratio": {
      "actual": 0.0005859375,
      "sample_count": 61,
      "source_artifact_digest": "sha256:659ff70ed1fdfeccb9e64dba7b8287cb52f9936bf52731c7951355d157e18ecf"
    },
    "controller_fd_growth": {
      "actual": 4,
      "sample_count": 183,
      "source_artifact_digest": "sha256:659ff70ed1fdfeccb9e64dba7b8287cb52f9936bf52731c7951355d157e18ecf"
    },
    "transportd_fd_growth": {
      "actual": 3,
      "sample_count": 61,
      "source_artifact_digest": "sha256:659ff70ed1fdfeccb9e64dba7b8287cb52f9936bf52731c7951355d157e18ecf"
    },
    "agent_fd_growth": {
      "actual": 2,
      "sample_count": 61,
      "source_artifact_digest": "sha256:659ff70ed1fdfeccb9e64dba7b8287cb52f9936bf52731c7951355d157e18ecf"
    },
    "controller_goroutine_growth": {
      "actual": 12,
      "sample_count": 183,
      "source_artifact_digest": "sha256:659ff70ed1fdfeccb9e64dba7b8287cb52f9936bf52731c7951355d157e18ecf"
    },
    "transportd_tokio_task_growth": {
      "actual": 7,
      "sample_count": 61,
      "source_artifact_digest": "sha256:659ff70ed1fdfeccb9e64dba7b8287cb52f9936bf52731c7951355d157e18ecf"
    },
    "agent_tokio_task_growth": {
      "actual": 4,
      "sample_count": 61,
      "source_artifact_digest": "sha256:659ff70ed1fdfeccb9e64dba7b8287cb52f9936bf52731c7951355d157e18ecf"
    },
    "database_connection_growth": {
      "actual": 2,
      "sample_count": 61,
      "source_artifact_digest": "sha256:659ff70ed1fdfeccb9e64dba7b8287cb52f9936bf52731c7951355d157e18ecf"
    },
    "queue_depth_end": {
      "actual": 0,
      "sample_count": 6,
      "source_artifact_digest": "sha256:659ff70ed1fdfeccb9e64dba7b8287cb52f9936bf52731c7951355d157e18ecf"
    },
    "outbox_oldest_age_seconds_end": {
      "actual": 0,
      "sample_count": 600,
      "source_artifact_digest": "sha256:11371f57dad0104f9fdd74cb0d387acd8eff1826efc0914fdcc4cdc7f280773c"
    }
  },
  "observations": {
    "database_failover_during_load": {
      "observed": true,
      "timeline_event_ids": [
        "load_started",
        "primary_failure_injected",
        "new_primary_writable",
        "api_recovered",
        "worker_recovered",
        "load_stopped"
      ],
      "source_artifact_digest": "sha256:88f91f045c5afc869371a9f6a05d4d8d66d20e1c7f8ae069db4af9b5b6f61cf5"
    },
    "dual_primary_prevention": {
      "observed": true,
      "timeline_event_ids": [
        "old_primary_isolated",
        "new_primary_promoted",
        "old_primary_write_rejected"
      ],
      "source_artifact_digest": "sha256:88f91f045c5afc869371a9f6a05d4d8d66d20e1c7f8ae069db4af9b5b6f61cf5"
    },
    "pitr_target_restore": {
      "observed": true,
      "timeline_event_ids": [
        "marker_a_written",
        "restore_point_created",
        "marker_b_written",
        "restore_verified"
      ],